{
  "id": "reports",
  "name": "Reports",
  "domain": "reports",
  "description": "Report surfaces beyond the core Budget view, including a projected-balance report that forecasts future balances from recurring schedules.",
  "routes": ["/reports", "/reports/projected-balance"],
  "keyActions": ["view report list", "view projected balance forecast"],
  "postHogEvents": [],
  "status": "active",
  "priority": null,
  "platforms": ["web"],
  "tags": ["reporting"]
}
