{
  "id": "goals",
  "name": "Savings Goals",
  "domain": "goals",
  "description": "Logical reservations inside a savings wallet, with one default goal funding auditable fallback releases after the computed Free remainder is exhausted.",
  "routes": [],
  "keyActions": [
    "create/edit/delete a savings goal",
    "categorize a transfer into a goal",
    "view goal progress against target amount"
  ],
  "postHogEvents": [],
  "status": "active",
  "priority": null,
  "platforms": ["web"],
  "tags": ["finance-core", "savings"]
}
