{
  "id": "investments",
  "name": "Investments",
  "domain": "investments",
  "description": "Investment positions with unit balances and live market-value quotes (via Deutsche Börse / FMP providers), tracked separately from cash totals.",
  "routes": [],
  "keyActions": ["record an investment purchase", "view position with live quote", "refresh instrument quote"],
  "postHogEvents": [],
  "status": "active",
  "priority": null,
  "platforms": ["web"],
  "tags": ["finance-core", "market-data"]
}
