{
  "id": "inbox",
  "name": "Inbox",
  "domain": "inbox",
  "description": "General intake surface for CSV and MCP batches awaiting review, separate from the Claude-specific inbox.",
  "routes": ["/inbox"],
  "keyActions": ["view pending batches", "open a batch for review"],
  "postHogEvents": [],
  "status": "active",
  "priority": null,
  "platforms": ["web"],
  "tags": ["import", "mcp-integration"]
}
