{
  "id": "claude-inbox",
  "name": "Claude Inbox",
  "domain": "claude-inbox",
  "description": "MCP-driven inbox for reviewing and confirming transactions/batches proposed by Claude (or another MCP client) acting on the user's finances.",
  "routes": ["/claude-inbox"],
  "keyActions": ["review MCP-proposed batch", "confirm or reject proposed transactions"],
  "postHogEvents": [],
  "status": "active",
  "priority": null,
  "platforms": ["web"],
  "tags": ["mcp", "ai-integration"]
}
