{
  "id": "banking",
  "name": "Bank Import (Banking)",
  "domain": "banking",
  "description": "CSV bank-statement import: parsing, merchant/category rule matching, and an approval queue that maps imported rows into real transactions.",
  "routes": ["/banking", "/imports"],
  "keyActions": [
    "upload a CSV bank statement",
    "review parsed rows and rule matches",
    "approve or reject import rows",
    "edit import mapping rules"
  ],
  "postHogEvents": [],
  "status": "active",
  "priority": null,
  "platforms": ["web"],
  "tags": ["finance-core", "import"]
}
