{
  "id": "auth",
  "name": "Authentication",
  "domain": "auth",
  "description": "Login and signup via Supabase Auth, plus session/logout handling shared across the app.",
  "routes": ["/login", "/signup"],
  "keyActions": ["sign up", "log in", "log out", "handle auth redirect"],
  "postHogEvents": [],
  "status": "active",
  "priority": null,
  "platforms": ["web"],
  "tags": ["infra", "identity"]
}
