{
  "id": "accounts",
  "name": "Accounts / Balance",
  "domain": "accounts",
  "description": "Wallet inventory and balance workspace: cash, savings (with goals), credit cards, and debts. The Balance page's left panel is the canonical inventory pattern for the whole app.",
  "routes": ["/accounts"],
  "keyActions": [
    "view wallet inventory grouped by type",
    "render the local iPhone snapshot immediately and reconcile it with Supabase",
    "create/edit/delete a wallet",
    "select a wallet to view its register",
    "create/edit/delete a savings goal within a saving wallet",
    "view credit card utilization"
  ],
  "postHogEvents": [],
  "status": "active",
  "priority": null,
  "platforms": ["web"],
  "tags": ["finance-core"]
}
