{
  "id": "categories",
  "name": "Categories",
  "domain": "categories",
  "description": "Hierarchical income/expense category tree shared by transactions, budget, and imports — create, edit, delete, and reparent categories.",
  "routes": [],
  "keyActions": ["create/edit/delete a category", "reorganize category tree", "pick a category on a transaction"],
  "postHogEvents": [],
  "status": "active",
  "priority": null,
  "platforms": ["web"],
  "tags": ["finance-core", "shared"]
}
